<?xml version="1.0" encoding="UTF-8"?>
<CHRIST xmlns:xsi="http://www.w3.org/2001/XMLSchema-instance" xsi:noNamespaceSchemaLocation="NewXMLSchema.xsd">
  <COMPUTER-SCIENCE>
    <STUD-NAME>VIKASH</STUD-NAME>
    <STUD-UNIVERSITY>ANNA MALAI</STUD-UNIVERSITY>
    <STUD-PHONE>6389676192</STUD-PHONE>
    <STUD-EMAIL>abcd1@gmail.com</STUD-EMAIL>
  </COMPUTER-SCIENCE>
   <COMPUTER-SCIENCE>
    <STUD-NAME>NIMISHA</STUD-NAME>
    <STUD-UNIVERSITY>SRM UNIVERSITY</STUD-UNIVERSITY>
    <STUD-PHONE>6489676192</STUD-PHONE>
    <STUD-EMAIL>xyz123@gmail.com</STUD-EMAIL>
  </COMPUTER-SCIENCE>
   <COMPUTER-SCIENCE>
    <STUD-NAME>HIMANSHU</STUD-NAME>
    <STUD-UNIVERSITY>WAI UNIVERSITY</STUD-UNIVERSITY>
    <STUD-PHONE>6789676192</STUD-PHONE>
    <STUD-EMAIL>weing234@gmail.com</STUD-EMAIL>
  </COMPUTER-SCIENCE>
</CHRIST>
